{"capabilities":[],"color_management":{"exposure_stops":0,"output_encoding":"srgb","tone_mapping":"none","white_balance_kelvin":6500,"working_space":"linear-srgb"},"dependencies":[{"id":"ceramic","kind":"material3d","path":"ceramic.json","sha256":"03786e0f158061adc810c728d1a51ad78deb85baf6acc4449a12fe6943f93548","version":"1.0.0"},{"id":"studio","kind":"lighting-rig3d","path":"studio.json","sha256":"faf7040dfb1787ac546e8b12460b4c61a76faca3ec351a6b3c5282ff792db0ea","version":"1.0.0"},{"id":"draft","kind":"render-quality3d","path":"draft.json","sha256":"3b389f8669987c1ac46066bf58b607ff79fc8f6b6aac80b82cb174769141d9af","version":"1.0.0"}],"id":"ceramic-look","identity":{"id":"pip","sha256":"bbbbbbbbbbbbbbbbbbbbbbbbbbbbbbbbbbbbbbbbbbbbbbbbbbbbbbbbbbbbbbbb","version":"1.0.0"},"kind":"look3d","lighting":{"id":"studio","kind":"lighting-rig3d","path":"studio.json","sha256":"faf7040dfb1787ac546e8b12460b4c61a76faca3ec351a6b3c5282ff792db0ea","version":"1.0.0"},"materials":{"body":{"id":"ceramic","kind":"material3d","path":"ceramic.json","sha256":"03786e0f158061adc810c728d1a51ad78deb85baf6acc4449a12fe6943f93548","version":"1.0.0"}},"provenance":{"attribution":"Self-authored engineering fixture","created_at":"2026-10-23T00:00:00Z","license":{"identifier":"CC0-1.0","source":"self-authored"},"origin":"procedural-fixture","source_hashes":[],"tool":"lookdev-contract-tests"},"quality":{"id":"draft","kind":"render-quality3d","path":"draft.json","sha256":"3b389f8669987c1ac46066bf58b607ff79fc8f6b6aac80b82cb174769141d9af","version":"1.0.0"},"schema_version":1,"style":{"id":"clay","sha256":"cccccccccccccccccccccccccccccccccccccccccccccccccccccccccccccccc","version":"1.0.0"},"validation_status":"unvalidated","version":"1.0.0"}
